{
  "schema_version": "1.0.0",
  "export_type": "browser_reproducible_project_publication",
  "contract": {
    "schema_version": "1.0.0",
    "compatible_repository_version": "1.0.0",
    "plugin_version": "1.8.0",
    "project_contract_version": "1.0.0",
    "publication_contract_version": "1.0.0",
    "parity_status": "mapped_project_contract_not_r_execution"
  },
  "project": {
    "schema_version": "1.0.0",
    "project_type": "reproducible_analytical_project",
    "id": "browser-transition-project",
    "title": "Browser Transition Project",
    "description": "A portable analytical project preserving scenario inputs, a governed run, interpretation, review, and publication records.",
    "owner": "Sustainable Catalyst",
    "scope": {
      "geography": "WORLD",
      "sector": "all",
      "period": "0-4 years",
      "decision_context": "educational scenario review"
    },
    "tags": [
      "reproducibility",
      "transition"
    ],
    "scenarios": {
      "baseline": {
        "schema_version": "1.0.0",
        "id": "baseline",
        "title": "Reference baseline",
        "role": "baseline",
        "model": {
          "id": "khncpa",
          "version": "1.0.0"
        },
        "time": {
          "start": 0,
          "end": 4,
          "step": 1,
          "unit": "year",
          "values": [
            0,
            1,
            2,
            3,
            4
          ]
        },
        "initial_state": {
          "K": 1,
          "H": 1,
          "N": 1,
          "C": 0,
          "P": 1,
          "A": 1
        },
        "policy": {
          "s": 0.18,
          "e": 0.03,
          "a": 0.01
        },
        "parameters": {
          "emissions_intensity": 0.3,
          "regen": 0.02
        },
        "constraints": {
          "emissions_budget": 10
        },
        "units": {
          "time": "year",
          "states": {
            "K": "index",
            "H": "index",
            "N": "index",
            "C": "index",
            "P": "people_index",
            "A": "index"
          },
          "flows": {
            "gdp": "index",
            "consumption": "index",
            "savings": "index",
            "education": "index",
            "abatement": "share",
            "emissions": "tCO2e_index",
            "depletion": "index",
            "damages": "index"
          }
        },
        "scope": {
          "geography": {
            "type": "global",
            "id": "WORLD",
            "label": "Global"
          },
          "sectors": [
            "all"
          ]
        },
        "currency": {
          "code": "index",
          "price_year": null
        },
        "sources": [],
        "assumptions": [],
        "uncertainty": [],
        "review": {
          "status": "draft",
          "reviewed_by": [],
          "notes": []
        },
        "metadata": {
          "description": "Deterministic reference scenario for Catalyst Analytics R v0.2.0.",
          "tags": [
            "reference",
            "canonical"
          ],
          "created_by": "catalystanalyticsr",
          "created_at": "2026-07-16T00:00:00Z"
        }
      },
      "transition-policy": {
        "schema_version": "1.0.0",
        "id": "transition-policy",
        "title": "Transition policy",
        "role": "intervention",
        "model": {
          "id": "khncpa",
          "version": "1.0.0"
        },
        "time": {
          "start": 0,
          "end": 4,
          "step": 1,
          "unit": "year",
          "values": [
            0,
            1,
            2,
            3,
            4
          ]
        },
        "initial_state": {
          "K": 1,
          "H": 1,
          "N": 1,
          "C": 0,
          "P": 1,
          "A": 1
        },
        "policy": {
          "s": 0.25,
          "e": 0.08,
          "a": 0.1
        },
        "parameters": {
          "emissions_intensity": 0.14,
          "regen": 0.05
        },
        "constraints": {
          "emissions_budget": 10
        },
        "units": {
          "time": "year",
          "states": {
            "K": "index",
            "H": "index",
            "N": "index",
            "C": "index",
            "P": "people_index",
            "A": "index"
          },
          "flows": {
            "gdp": "index",
            "consumption": "index",
            "savings": "index",
            "education": "index",
            "abatement": "share",
            "emissions": "tCO2e_index",
            "depletion": "index",
            "damages": "index"
          }
        },
        "scope": {
          "geography": {
            "type": "global",
            "id": "WORLD",
            "label": "Global"
          },
          "sectors": [
            "all"
          ]
        },
        "currency": {
          "code": "index",
          "price_year": null
        },
        "sources": [],
        "assumptions": [],
        "uncertainty": [],
        "review": {
          "status": "draft",
          "reviewed_by": [],
          "notes": []
        },
        "metadata": {
          "description": "Deterministic reference scenario for Catalyst Analytics R v0.2.0.",
          "tags": [
            "reference",
            "canonical"
          ],
          "created_by": "catalystanalyticsr",
          "created_at": "2026-07-16T00:00:00Z"
        }
      }
    },
    "datasets": {},
    "models": {
      "khncpa@1.0.0": {
        "schema_version": "1.0.0",
        "id": "khncpa",
        "version": "1.0.0",
        "title": "KH-NC-PA Vector Dynamics Model",
        "description": "A coupled produced-capital, human-capital, natural-capital, atmospheric-carbon, population, and technology scenario model.",
        "required_states": [
          "K",
          "H",
          "N",
          "C",
          "P",
          "A"
        ],
        "default_state": {
          "K": 1,
          "H": 1,
          "N": 1,
          "C": 0,
          "P": 1,
          "A": 1
        },
        "default_parameters": {
          "alpha": 0.3,
          "beta": 0.3,
          "gamma": 0.1,
          "deltaK": 0.05,
          "deltaH": 0.03,
          "Nmax": 1,
          "regen": 0.02,
          "depletion_intensity": 0.01,
          "emissions_intensity": 0.3,
          "absorption": 0.1,
          "C0": 0,
          "damage_scale": 0.001,
          "pop_growth": 0.01,
          "Pmax": null,
          "tech_growth": 0.01,
          "abatement_cost_scale": 0.02
        },
        "default_policy": {
          "s": 0.2,
          "e": 0.05,
          "a": 0
        },
        "integration_methods": [
          "rk4",
          "euler"
        ],
        "state_units": {
          "K": "index",
          "H": "index",
          "N": "index",
          "C": "index",
          "P": "people_index",
          "A": "index"
        },
        "flow_map": {
          "gdp": "Y",
          "consumption": "consumption",
          "savings": "savings",
          "education": "education",
          "abatement": "a",
          "emissions": "emissions",
          "depletion": "depletion",
          "damages": "damages"
        },
        "flow_units": {
          "gdp": "index",
          "consumption": "index",
          "savings": "index",
          "education": "index",
          "abatement": "share",
          "emissions": "tCO2e_index",
          "depletion": "index",
          "damages": "index"
        },
        "indicator_map": {
          "gdp": {
            "source": "gdp",
            "unit": "index",
            "direction": "higher_better"
          },
          "emissions": {
            "source": "emissions",
            "unit": "tCO2e_index",
            "direction": "lower_better"
          },
          "ans": {
            "source": "ans",
            "unit": "index",
            "direction": "higher_better"
          },
          "natural_capital": {
            "source": "N",
            "unit": "index",
            "direction": "higher_better"
          },
          "atmospheric_carbon": {
            "source": "C",
            "unit": "index",
            "direction": "lower_better"
          }
        },
        "metadata": {
          "contract_version": "1.0.0",
          "status": "experimental",
          "intended_use": "Exploratory sustainable-development scenario analysis",
          "prohibited_uses": [
            "forecast",
            "compliance determination",
            "professional advice"
          ]
        }
      }
    },
    "parameter_sets": {},
    "runs": {
      "baseline-run": {
        "schema_version": "1.0.0",
        "id": "baseline-run",
        "label": "Reference baseline browser run",
        "status": "completed",
        "scenario_ids": [
          "baseline"
        ],
        "model": {
          "id": "khncpa",
          "version": "1.0.0"
        },
        "created_at": "2026-07-17T17:30:00Z",
        "completed_at": "2026-07-17T17:30:00Z",
        "package": {
          "name": "catalystanalyticsr-browser-companion",
          "version": "1.8.0"
        },
        "environment": {
          "schema_version": "1.0.0",
          "runtime": "browser",
          "user_agent": "fixture"
        },
        "input_hash": "8860657e4f2537a714c1f25dd976bd99",
        "output_hash": "9e3ef8470296921e27d61e14a673ce38",
        "inputs": {
          "scenario": {
            "schema_version": "1.0.0",
            "id": "baseline",
            "title": "Reference baseline",
            "role": "baseline",
            "model": {
              "id": "khncpa",
              "version": "1.0.0"
            },
            "time": {
              "start": 0,
              "end": 4,
              "step": 1,
              "unit": "year",
              "values": [
                0,
                1,
                2,
                3,
                4
              ]
            },
            "initial_state": {